global_ID,local_ID,structure,post_date,comm_date,subreddit,upvote_prop,post_score,author,user,comment_score,controversiality,comment,title,link,Entities,rand_ID,player_mentions,
16802,302,71,4/11/2019,4/11/2019,NYKnicks,0.93,52,HokageEzio,AnimalRomano,2,0,"My stream failed so I couldn't watch all the game, looks it was warning me of the eventual blowout.","[Post Game Thread] The Sacramento Kings (2-5) exterminate the @ New York Knicks (1-6), 113 - 92",https://www.reddit.com/r/NYKnicks/comments/draeuh/post_game_thread_the_sacramento_kings_25/,,4.2E-05,,
17948,126,36_2_1_2_1_1_1,14-12-19,14-12-19,NYKnicks,0.99,149,HokageEzio,a_prkk,4,0,"Yeah, it's not like I was commenting in the game thread or anything...

Nice try tho, you were almost was able to save face.",[Post Game Thread] [Post Game Thread] The New York Knicks (6-20) defeat the Sacramento Kings (11-14) 103-101 behind Julius Randle's 26/9/4 night for the first win streak of the year,https://www.reddit.com/r/NYKnicks/comments/eafro9/post_game_thread_post_game_thread_the_new_york/,,0.000121759,,
19018,48,14_1_1,17-01-20,17-01-20,NYKnicks,0.99,137,HokageEzio,wkp2101,1,0,good thing we are in the midst of a long rebuild,"[Post Game Thread] Knicks (11-31) lose to the Suns (17-24) in a blow out (January 16, 2020)",https://i.redd.it/j0sh707d49b41.png,,0.000310746,,
17393,233,70_3,25-11-19,25-11-19,NYKnicks,0.96,46,CraYzySaurous574,FermatsLastAccount,9,0,"Lmao, your game thread got 350 comments.",Post Game Thread - Knicks lose to the Nets 103-101,https://www.reddit.com/r/NYKnicks/comments/e18kgr/post_game_thread_knicks_lose_to_the_nets_103101/,,0.000348565,,
18304,221,77,27-12-19,27-12-19,NYKnicks,0.99,702,HokageEzio,TheKnicksHateMe,50,0,its always nice to win on your home court.,[Post Game Thread] Knicks (8-24) blow out the Nets (16-14) at Barclays, Nets set an all time low for 2 point field goals in the 3 point era, Final score 94-82,https://i.redd.it/58aerfqj73741.jpg,,0.000380258
